{
  "$schema": "http://json-schema.org/draft-04/schema#",
  "additionalProperties": false,
  "properties": {
    "assigned_to": {
      "type": "integer"
    },
    "blocked_by": {
      "items": {
        "type": "integer"
      },
      "type": "array"
    },
    "bug_id": {
      "minimum": 1,
      "type": "integer"
    },
    "bug_severity": {
      "type": "string"
    },
    "bug_status": {
      "type": "string"
    },
    "component": {
      "type": "string"
    },
    "creation_ts": {
      "type": "string"
    },
    "delta_ts": {
      "type": "string"
    },
    "depends_on": {
      "items": {
        "type": "integer"
      },
      "type": "array"
    },
    "duplicate_of": {
      "type": [
        "null",
        "integer"
      ]
    },
    "duplicates": {
      "items": {
        "type": "integer"
      },
      "type": "array"
    },
    "flags": {
      "items": {
        "additionalProperties": false,
        "properties": {
          "name": {
            "type": "string"
          },
          "requestee_id": {
            "type": [
              "null",
              "integer"
            ]
          },
          "setter_id": {
            "type": "integer"
          },
          "status": {
            "enum": [
              "?",
              "+",
              "-"
            ],
            "type": "string"
          }
        },
        "required": [
          "status",
          "name",
          "setter_id",
          "requestee_id"
        ],
        "type": "object"
      },
      "type": "array"
    },
    "groups": {
      "items": {
        "type": "string"
      },
      "type": "array"
    },
    "keywords": {
      "items": {
        "type": "string"
      },
      "type": "array"
    },
    "priority": {
      "type": "string"
    },
    "product": {
      "type": "string"
    },
    "qa_contact": {
      "type": [
        "null",
        "integer"
      ]
    },
    "reporter": {
      "type": "integer"
    },
    "resolution": {
      "type": "string"
    },
    "target_milestone": {
      "type": "string"
    },
    "version": {
      "type": "string"
    }
  },
  "required": [
    "priority",
    "blocked_by",
    "duplicate_of",
    "bug_id",
    "reporter",
    "keywords",
    "duplicates",
    "assigned_to",
    "creation_ts",
    "groups",
    "qa_contact",
    "bug_severity",
    "depends_on",
    "bug_status",
    "delta_ts",
    "flags",
    "version",
    "component",
    "product",
    "target_milestone"
  ],
  "type": "object"
}
