{
   "assigned_to" : 1,
   "blocked_by" : [],
   "bug_id" : 1526431,
   "bug_severity" : "normal",
   "bug_status" : "NEW",
   "component" : "Testing",
   "creation_ts" : "2019-02-08 11:09:58",
   "delta_ts" : "2019-02-08T12:14:22",
   "depends_on" : [],
   "duplicate_of" : null,
   "duplicates" : [],
   "flags" : [
      {
         "name" : "needinfo",
         "requestee_id" : 408096,
         "setter_id" : 23402,
         "status" : "?"
      }
   ],
   "groups" : [],
   "keywords" : [],
   "priority" : "--",
   "product" : "Firefox for Android",
   "qa_contact" : null,
   "reporter" : 474533,
   "resolution" : "",
   "target_milestone" : "---",
   "version" : "unspecified"
}
