{
   "assigned_to" : 99,
   "blocked_by" : [],
   "bug_id" : 200,
   "bug_severity" : "trivial",
   "bug_status" : "VERIFIED",
   "component" : "Layout",
   "creation_ts" : "1998-04-14 02:09:13",
   "delta_ts" : "2008-11-21T13:41:32",
   "depends_on" : [],
   "duplicate_of" : null,
   "duplicates" : [],
   "flags" : [],
   "groups" : [],
   "keywords" : [],
   "priority" : "P3",
   "product" : "MozillaClassic Graveyard",
   "qa_contact" : null,
   "reporter" : 86,
   "resolution" : "FIXED",
   "target_milestone" : "---",
   "version" : "1998-03-31"
}
