{
   "assigned_to" : 1,
   "blocked_by" : [
      1526109
   ],
   "bug_id" : 1526430,
   "bug_severity" : "normal",
   "bug_status" : "NEW",
   "component" : "Application Update",
   "creation_ts" : "2019-02-08 11:09:26",
   "delta_ts" : "2019-02-08T11:21:12",
   "depends_on" : [
      1524400
   ],
   "duplicate_of" : null,
   "duplicates" : [],
   "flags" : [],
   "groups" : [],
   "keywords" : [
      "regression",
      "intermittent-failure"
   ],
   "priority" : "P5",
   "product" : "Toolkit",
   "qa_contact" : null,
   "reporter" : 573381,
   "resolution" : "",
   "target_milestone" : "---",
   "version" : "unspecified"
}
